{
  "$schema": "https://json-schema.org/draft/2020-12/schema",
  "$id": "https://github.com/mdg-labs/skills/plugins/mdg-workflow/workflow.schema.json",
  "title": "MDG Labs workflow config (.claude/workflow.json)",
  "description": "Machine-read, per-repo settings for the vendored skills, agents and scripts. Prose the agents read (area \u2192 paths, always-shared files, design-doc map) lives in the repo's CLAUDE.md '## Agent workflow' section instead.",
  "type": "object",
  "required": [
    "repo",
    "tracker",
    "branches",
    "landing",
    "gate"
  ],
  "additionalProperties": false,
  "properties": {
    "$schema": {
      "type": "string"
    },
    "repo": {
      "description": "owner/name every gh call is scoped to.",
      "type": "string",
      "pattern": "^[A-Za-z0-9_.-]+/[A-Za-z0-9_.-]+$"
    },
    "maintainer": {
      "description": "GitHub login auto-assigned to unowned issues by issue-status.yml (GitHub tracker only).",
      "type": "string"
    },
    "githubRunner": {
      "description": "The `runs-on` value for GitHub Actions jobs setup renders (the issue-status workflow), as written in YAML: a label (\"ubuntu-latest\") or a label list (\"[self-hosted, runners01]\"). Private repos use the self-hosted runners. Default \"ubuntu-latest\".",
      "type": "string"
    },
    "tracker": {
      "oneOf": [
        {
          "type": "object",
          "required": [
            "type"
          ],
          "additionalProperties": false,
          "properties": {
            "type": {
              "const": "github"
            }
          }
        },
        {
          "type": "object",
          "required": [
            "type",
            "workspaceId",
            "projectId",
            "ticketKey"
          ],
          "additionalProperties": false,
          "properties": {
            "type": {
              "const": "kaneo"
            },
            "workspaceId": {
              "type": "string"
            },
            "projectId": {
              "type": "string"
            },
            "ticketKey": {
              "description": "Ticket prefix, e.g. RO for RO-<n>.",
              "type": "string",
              "pattern": "^[A-Z][A-Z0-9]*$"
            }
          }
        }
      ]
    },
    "branches": {
      "type": "object",
      "required": [
        "integration",
        "production"
      ],
      "additionalProperties": false,
      "properties": {
        "integration": {
          "description": "Where verified work lands (e.g. dev). Equal to production in pr-per-unit repos without a dev branch.",
          "type": "string"
        },
        "production": {
          "description": "Moves only through a PR the maintainer merges.",
          "type": "string"
        }
      }
    },
    "landing": {
      "description": "dev-cherry-pick: a PASS is cherry-picked onto the integration branch and pushed. pr-per-unit: a PASS becomes its own PR against production, stacked when it depends on an unmerged one.",
      "enum": [
        "dev-cherry-pick",
        "pr-per-unit"
      ]
    },
    "promotionBudget": {
      "description": "Cap on reviewable files in the integration \u2192 production diff (CodeRabbit's Essentials limit is 150 files per PR, counted after path_filters); null disables the budget.",
      "type": [
        "integer",
        "null"
      ],
      "minimum": 1
    },
    "review": {
      "description": "The review bots pr-review works with. A round collects the findings of every listed bot that completed a review of the PR's head, and needs at least one; a listed bot that skipped or was rate limited is reported, not treated as clean. CodeQL is not listed: pr-review reads code scanning alerts on every repository that has an analysis.",
      "type": "object",
      "additionalProperties": false,
      "properties": {
        "reviewers": {
          "description": "Default [\"kodus\", \"coderabbit\"]. pr-review never requests a review from either; the maintainer does (`@kody start-review`, `@coderabbitai review`).",
          "type": "array",
          "minItems": 1,
          "uniqueItems": true,
          "items": {
            "enum": [
              "kodus",
              "coderabbit"
            ]
          }
        },
        "kodusConfig": {
          "description": "owner/name of the org's Kodus config repo (e.g. mdg-labs/kodus-config). pr-review files there, as issues, the memories and rules Kody should learn; `gh-rest.sh kodus-config` is the only route to it. Absent: pr-review lists them in its report instead.",
          "type": "string",
          "pattern": "^[A-Za-z0-9_.-]+/[A-Za-z0-9_.-]+$"
        }
      }
    },
    "gate": {
      "description": "The full gate: must pass before anything is pushed or lands (executor, verifier, pr-review). Per-path checks go in `checks`.",
      "type": "string"
    },
    "threatModel": {
      "description": "Repo-relative path of the threat model security-audit and the verifier read; null when the repo has none. security-audit requires it, in the format of skills/security-audit/threat-model-format.md.",
      "type": [
        "string",
        "null"
      ]
    },
    "security": {
      "description": "Where security findings go.",
      "type": "object",
      "additionalProperties": false,
      "properties": {
        "privateRepoIssues": {
          "description": "While the repository is private, file every security finding, Critical and High included, as an ordinary item labelled security instead of a draft private security advisory. GitHub offers no security advisories or private vulnerability reporting on a private repository. Absent: follows the repository's visibility, so a private repository files issues. false is an error while the repository is private (security-route.sh exits 2), since GitHub offers a private repository no advisories. On a public repository findings always go to advisories, whatever this says. .claude/scripts/security-route.sh reads the visibility live and prints the result (issues or advisories). Commit messages for security fixes stay neutral either way.",
          "type": "boolean"
        }
      }
    },
    "securityAudit": {
      "description": "security-audit settings. The review units themselves live in CLAUDE.md '### Security units'.",
      "type": "object",
      "additionalProperties": false,
      "properties": {
        "epic": {
          "description": "Epic the file mode puts public findings under when no --epic is given: #<n> on GitHub, <KEY>-<n> on Kaneo. Absent: findings are filed with no epic.",
          "type": "string",
          "pattern": "^(#[0-9]+|[A-Z][A-Z0-9]*-[0-9]+)$"
        },
        "exclude": {
          "description": "Extra repo-relative globs that are not shipped source (generated code, fixtures, vendored copies), left out of the audit's coverage check on top of the generic test/generated/docs set and .coderabbit.yaml's excluded path_filters.",
          "type": "array",
          "items": {
            "type": "string"
          }
        }
      }
    },
    "labels": {
      "type": "object",
      "additionalProperties": false,
      "properties": {
        "areas": {
          "type": "array",
          "items": {
            "$ref": "#/$defs/label"
          }
        },
        "risk": {
          "description": "Label for paths where a bug loses data (e.g. safety-critical, data-loss-risk): Opus verifier, never bundled, called out in the PR.",
          "$ref": "#/$defs/label"
        },
        "maintainerOnly": {
          "description": "Label for work only the maintainer may run (e.g. needs-sudo); orchestrate prepares it instead of dispatching it. Maintainer-applied: gh-rest.sh refuses to add it.",
          "$ref": "#/$defs/label"
        },
        "extra": {
          "type": "array",
          "items": {
            "$ref": "#/$defs/extraLabel"
          }
        },
        "spike": {
          "description": "Override the spike type label name. Default spike.",
          "type": "string"
        }
      }
    },
    "readiness": {
      "type": "object",
      "additionalProperties": false,
      "properties": {
        "requireReachableVia": {
          "description": "feat/bug issues need a 'Reachable via:' acceptance criterion. Default true.",
          "type": "boolean"
        },
        "stale": {
          "description": "Terms that mark an issue as written against a retired design.",
          "type": "array",
          "items": {
            "type": "object",
            "required": [
              "pattern",
              "reason"
            ],
            "additionalProperties": false,
            "properties": {
              "pattern": {
                "description": "Extended regex, case-insensitive.",
                "type": "string"
              },
              "reason": {
                "type": "string"
              },
              "exempt": {
                "description": "Lines also matching this ERE are not stale (they cite the decision or negate the term).",
                "type": "string"
              }
            }
          }
        }
      }
    },
    "checks": {
      "description": "Checks to run when a change touches matching paths \u2014 what the executor runs before committing and the verifier re-runs under layer 1. Mirror the CI jobs those paths feed.",
      "type": "array",
      "items": {
        "type": "object",
        "required": [
          "paths",
          "run"
        ],
        "additionalProperties": false,
        "properties": {
          "paths": {
            "type": "array",
            "items": {
              "type": "string"
            },
            "minItems": 1,
            "description": "Globs, repo-relative."
          },
          "run": {
            "type": "string"
          },
          "requires": {
            "type": "array",
            "items": {
              "type": "string"
            },
            "description": "Tools that must be installed (checked with command -v at the start of a run); a missing one is reported, never installed."
          }
        }
      }
    },
    "bootstrap": {
      "description": "Command run once in every fresh scratch clone before any agent works in it (e.g. dependency install). null when none.",
      "type": [
        "string",
        "null"
      ]
    },
    "riskPaths": {
      "description": "Globs whose changes are treated like the risk label: Opus verifier, never bundled, full risk review.",
      "type": "array",
      "items": {
        "type": "string"
      }
    },
    "signoff": {
      "description": "How commits get a DCO Signed-off-by trailer. hook: the repo's prepare-commit-msg hook adds it (clones point core.hooksPath at hooksPath); flag: git commit -s; none: no sign-off.",
      "type": "object",
      "required": [
        "mode"
      ],
      "additionalProperties": false,
      "properties": {
        "mode": {
          "enum": [
            "none",
            "hook",
            "flag"
          ]
        },
        "hooksPath": {
          "type": "string"
        }
      }
    },
    "models": {
      "type": "object",
      "additionalProperties": false,
      "properties": {
        "verifier": {
          "enum": [
            "opus",
            "sonnet",
            "auto"
          ],
          "description": "auto: sonnet, escalated to opus for risk-flagged and large-diff units. Advisory units are verified on opus under every setting. Default auto."
        },
        "refiner": {
          "enum": [
            "opus",
            "sonnet",
            "auto"
          ],
          "description": "auto: sonnet, opus when any issue is risk-labelled. Default auto."
        }
      }
    },
    "limits": {
      "type": "object",
      "additionalProperties": false,
      "properties": {
        "bundle": {
          "type": "integer",
          "minimum": 1,
          "description": "Max items per executor dispatch. Default 3."
        },
        "attempts": {
          "type": "integer",
          "minimum": 1,
          "description": "Fix attempts before asking, unless findings keep narrowing. Default 3."
        },
        "rebaseRetries": {
          "type": "integer",
          "minimum": 0,
          "description": "Re-runs after a landing conflict. Default 2."
        },
        "lanes": {
          "type": "integer",
          "minimum": 1,
          "description": "Max parallel lanes. Default 3."
        },
        "growth": {
          "type": "integer",
          "minimum": 0,
          "description": "Pulled-in items allowed before asking. Default 3."
        },
        "confirmAbove": {
          "type": "integer",
          "minimum": 1,
          "description": "Confirm the plan with the maintainer above this many items. Default 12."
        },
        "inSessionFindings": {
          "type": "integer",
          "minimum": 0,
          "description": "pr-review fixes a round in-session when it has at most this many small, non-risk findings; otherwise it delegates to executor/verifier agents. Default 5."
        }
      }
    },
    "largeDiff": {
      "type": "object",
      "additionalProperties": false,
      "properties": {
        "lines": {
          "type": "integer",
          "minimum": 1,
          "description": "Changed lines (generated code excluded) above which the verifier is Opus under models.verifier auto, and the report names the item. Default 2000."
        }
      }
    },
    "act": {
      "description": "Lets the executor and verifier run the GitHub Actions jobs a unit changes locally with nektos/act, through .claude/scripts/act-run.sh. null disables it (changed workflows are then judged by reading them, plus actionlint).",
      "type": [
        "object",
        "null"
      ],
      "additionalProperties": false,
      "properties": {
        "platforms": {
          "type": "object",
          "additionalProperties": {
            "type": "string"
          },
          "description": "runs-on label \u2192 container image, passed to act as -P. Name every label the repo's workflows use, e.g. ubuntu-latest and runners01."
        },
        "neverRun": {
          "type": "array",
          "items": {
            "type": "string"
          },
          "description": "Job-id globs never run locally, also when another job needs them: deploys, migrations, releases, publishing, secret syncs."
        },
        "timeout": {
          "type": "integer",
          "minimum": 1,
          "description": "Seconds for one run, and for waiting on another lane's run. Default 1800."
        }
      }
    },
    "pr": {
      "description": "pr-per-unit landing only.",
      "type": "object",
      "additionalProperties": false,
      "properties": {
        "branchPrefix": {
          "type": "string",
          "description": "Default agent/. A unit's branch is <prefix><unit-id>."
        }
      }
    },
    "landingRepos": {
      "description": "Sibling repositories an item may land in, selected by a 'Lands in: owner/repo' line in its body. The item stays tracked here; its commit closes it with 'Fixes <repo>#n'.",
      "type": "array",
      "items": {
        "type": "object",
        "required": [
          "repo",
          "pathEnv",
          "defaultPath",
          "gate"
        ],
        "additionalProperties": false,
        "properties": {
          "repo": {
            "type": "string"
          },
          "pathEnv": {
            "type": "string",
            "description": "Env var holding the local clone path."
          },
          "defaultPath": {
            "type": "string",
            "description": "Path relative to this repo when the env var is unset."
          },
          "gate": {
            "type": "string"
          },
          "postVerdict": {
            "type": "boolean",
            "description": "Whether verifiers post their verdict comment on items landing here. false for routine items (e.g. template bumps) where a long verdict is noise; the verdict then goes to the orchestrator only. Default true."
          }
        }
      }
    },
    "unitEnvironment": {
      "description": "A per-unit isolated environment (e.g. a loop-device lab) agents must start under the unit id and destroy before reporting.",
      "type": "object",
      "required": [
        "idVar",
        "teardown"
      ],
      "additionalProperties": false,
      "properties": {
        "idVar": {
          "type": "string",
          "description": "Env var carrying the unit id, e.g. HOSERVA_LAB_ID."
        },
        "teardown": {
          "type": "string",
          "description": "Command, run in the clone, that destroys the unit's environment. {UNIT} is replaced by the unit id."
        },
        "leftoverCheck": {
          "type": "string",
          "description": "Command that prints nothing when no environment is left behind. {UNIT} is replaced by the unit id."
        }
      }
    },
    "docs": {
      "description": "Public docs pages that have their own writing guide.",
      "type": "object",
      "required": [
        "paths",
        "guide"
      ],
      "additionalProperties": false,
      "properties": {
        "paths": {
          "type": "array",
          "items": {
            "type": "string"
          }
        },
        "guide": {
          "type": "string",
          "description": "Repo-relative path of the skill/guide agents read before writing a page."
        },
        "build": {
          "type": "string"
        }
      }
    }
  },
  "$defs": {
    "label": {
      "type": "object",
      "required": [
        "name"
      ],
      "additionalProperties": false,
      "properties": {
        "name": {
          "type": "string"
        },
        "color": {
          "type": "string",
          "pattern": "^[0-9a-fA-F]{6}$"
        },
        "description": {
          "type": "string"
        }
      }
    },
    "extraLabel": {
      "type": "object",
      "required": [
        "name"
      ],
      "additionalProperties": false,
      "properties": {
        "name": {
          "type": "string"
        },
        "color": {
          "type": "string",
          "pattern": "^[0-9a-fA-F]{6}$"
        },
        "description": {
          "type": "string"
        },
        "maintainerApplied": {
          "description": "Only the maintainer applies this label, because a CI gate or a skill reads it as the maintainer's approval (e.g. migration:contract). gh-rest.sh issue-create and issue-edit refuse to add it; removing it stays possible. A guard against accidents, not a security boundary: an agent calling the API directly with the same credential can still apply it.",
          "type": "boolean"
        }
      }
    }
  }
}
